{
  "$schema": "http://json-schema.org/draft-07/schema#",
  "title": "Lens-Observer Deficiency Map & Bounded Evolution Edits",
  "description": "What the Lens Observer (secondary model instance) returns after analyzing the primary's inferred-lens readout against the required-variable / procedure spec. Diagnoses deficiencies, proposes bounded auditable edits across the five evolution surfaces, and updates the Session Working-Consciousness. Anti-Goodhart: every edit must cite readout-grounded evidence. Never edits the protected guardrail; never imputes patient values.",
  "type": "object",
  "additionalProperties": false,
  "required": [
    "deficiencies",
    "proposed_edits",
    "swc_update",
    "non_diagnostic_disclaimer"
  ],
  "properties": {
    "deficiencies": {
      "type": "array",
      "description": "Readout-grounded gaps. Empty array = the readout met the spec this turn (a valid result).",
      "items": {
        "type": "object",
        "additionalProperties": false,
        "required": ["kind", "detail", "evidence", "severity"],
        "properties": {
          "kind": {
            "type": "string",
            "enum": [
              "missing_mediator",
              "missing_variable",
              "wrong_value",
              "uncovered_cot_step",
              "underspecified_problem"
            ]
          },
          "detail": { "type": "string", "description": "The specific mediator/variable/step and why it is deficient." },
          "evidence": { "type": "string", "description": "The exact readout signal that grounds this (absent concept, faint salience, variable not present, step skipped). No evidence => not a deficiency." },
          "severity": { "type": "string", "enum": ["blocking", "important", "minor"] }
        }
      }
    },
    "proposed_edits": {
      "type": "array",
      "description": "Bounded, auditable edits. Each must map to a deficiency by its evidence.",
      "items": {
        "type": "object",
        "additionalProperties": false,
        "required": ["surface", "tier", "edit_type", "target", "change", "rationale", "guardrail_safe"],
        "properties": {
          "surface": {
            "type": "string",
            "enum": ["work_prompt", "skill", "kb_context", "injected_variables", "subagent_def", "harness_code"]
          },
          "tier": {
            "type": "string",
            "enum": ["T0_ephemeral", "T1_promoted"],
            "description": "T0 lives in-session and auto-reverts; T1 is a repo commit requiring the full gate + human approval."
          },
          "edit_type": { "type": "string", "enum": ["add", "delete", "replace"] },
          "target": { "type": "string", "description": "File path and/or field the edit applies to." },
          "change": { "type": "string", "description": "The concrete edit (changed lines / added snippet / new variable + derivation)." },
          "rationale": { "type": "string", "description": "Cites the deficiency evidence that justifies this edit." },
          "guardrail_safe": { "type": "boolean", "description": "Must be true: the edit does not touch the protected guardrail and does not impute a patient value." },
          "corroboration": {
            "type": "string",
            "description": "Optional API-observable check to confirm the lens claim, e.g. a counterfactual-sensitivity flip (flip a factor; the affected axis should move).",
            "enum": ["counterfactual_sensitivity", "reread_next_turn", "none"]
          },
          "requires_test": {
            "type": "boolean",
            "description": "For harness_code edits: the generated + existing tests must pass in a sandbox before the output is used."
          }
        }
      }
    },
    "swc_update": {
      "type": "object",
      "additionalProperties": false,
      "description": "How the Session Working-Consciousness ledger evolves this turn.",
      "required": ["consolidated_beliefs", "pending_hypotheses"],
      "properties": {
        "consolidated_beliefs": {
          "type": "array",
          "description": "Stable lessons promoted from repeated evidence across turns.",
          "items": { "type": "string" }
        },
        "pending_hypotheses": {
          "type": "array",
          "description": "Things still to test in later turns.",
          "items": { "type": "string" }
        },
        "prompt_injection": {
          "type": "object",
          "additionalProperties": false,
          "description": "Optional live modification the Observer injects into the next prompt, per its own criterion.",
          "required": ["what", "why"],
          "properties": {
            "what": { "type": "string" },
            "why": { "type": "string", "description": "SWC/readout grounding for the injection." }
          }
        }
      }
    },
    "non_diagnostic_disclaimer": { "const": true }
  }
}
